{
  "schema_version": "0.1.0",
  "program": {
    "id": "customer-care",
    "name": "Customer Care Program",
    "program_type": "WEB_APPLICATION",
    "origin": "ANALYSIS",
    "truth": "OBSERVED",
    "evidence_ids": ["EV-program"],
    "confidence": 1,
    "verification_status": "VERIFIED",
    "provenance": [{"method": "OBSERVED", "source_adapter": "WEB_ACCESSIBILITY", "source_ref": "capture:customer-care"}]
  },
  "snapshots": [
    {"snapshot_id": "SNAP-original-001", "model_kind": "ORIGINAL_MODEL", "based_on_snapshot_id": null, "immutable": true, "entity_refs": ["PROGRAM:customer-care", "SCREEN:login", "SCREEN:dashboard", "SCREEN:customer-list", "SCREEN:customer-detail", "SCREEN:consultation"], "relation_refs": ["REL-screen-search"], "created_at": "2026-08-29T06:00:00Z"},
    {"snapshot_id": "SNAP-working-001", "model_kind": "WORKING_MODEL", "based_on_snapshot_id": "SNAP-original-001", "immutable": false, "entity_refs": ["PROGRAM:customer-care", "FLOW:customer-flow", "DECISION:DEC-verify-customer-flow"], "relation_refs": ["REL-search-trigger", "REL-action-behavior", "REL-behavior-flow", "REL-behavior-read"], "created_at": "2026-08-29T06:05:00Z"},
    {"snapshot_id": "SNAP-generated-001", "model_kind": "GENERATED_MODEL", "based_on_snapshot_id": "SNAP-working-001", "immutable": true, "entity_refs": ["PROGRAM:customer-care", "FLOW:customer-flow"], "relation_refs": ["REL-behavior-flow"], "sanitizer_status": "REVIEW_REQUIRED", "created_at": "2026-08-29T06:10:00Z"}
  ],
  "model_revisions": [
    {"revision_id": "REV-original-001", "snapshot_id": "SNAP-original-001", "parent_revision_id": null, "change_source": "ANALYSIS", "created_at": "2026-08-29T06:00:00Z"},
    {"revision_id": "REV-working-001", "snapshot_id": "SNAP-working-001", "parent_revision_id": "REV-original-001", "change_source": "USER_DECISION", "created_at": "2026-08-29T06:05:00Z"},
    {"revision_id": "REV-generated-001", "snapshot_id": "SNAP-generated-001", "parent_revision_id": "REV-working-001", "change_source": "SANITIZER", "created_at": "2026-08-29T06:10:00Z"}
  ],
  "entities": {
    "screens": [
      {"id": "login", "name": "Login", "purpose": "Authenticate a user", "origin": "ANALYSIS", "truth": "OBSERVED", "evidence_ids": ["EV-login"], "confidence": 1, "verification_status": "VERIFIED", "provenance": [{"method": "OBSERVED", "source_adapter": "WEB_ACCESSIBILITY"}]},
      {"id": "dashboard", "name": "Dashboard", "purpose": "Show the application overview", "origin": "ANALYSIS", "truth": "OBSERVED", "evidence_ids": ["EV-dashboard"], "confidence": 0.98, "verification_status": "VERIFIED", "provenance": [{"method": "OBSERVED", "source_adapter": "WEB_ACCESSIBILITY"}]},
      {"id": "customer-list", "name": "Customer List", "purpose": "Search and browse customers", "origin": "ANALYSIS", "truth": "OBSERVED", "evidence_ids": ["EV-customer-list"], "confidence": 1, "verification_status": "VERIFIED", "provenance": [{"method": "OBSERVED", "source_adapter": "WEB_ACCESSIBILITY"}]},
      {"id": "customer-detail", "name": "Customer Detail", "purpose": "Review a selected customer", "origin": "ANALYSIS", "truth": "OBSERVED", "evidence_ids": ["EV-customer-detail"], "confidence": 1, "verification_status": "VERIFIED", "provenance": [{"method": "OBSERVED", "source_adapter": "WEB_ACCESSIBILITY"}]},
      {"id": "consultation", "name": "Consultation", "purpose": "Record customer consultation", "origin": "ANALYSIS", "truth": "OBSERVED", "evidence_ids": ["EV-consultation"], "confidence": 1, "verification_status": "VERIFIED", "provenance": [{"method": "OBSERVED", "source_adapter": "WEB_ACCESSIBILITY"}]}
    ],
    "components": [
      {"id": "sidebar", "name": "Sidebar", "semantic_role": "PRIMARY_NAVIGATION", "origin": "ANALYSIS", "truth": "OBSERVED", "evidence_ids": ["EV-dashboard"], "confidence": 0.98, "verification_status": "VERIFIED", "provenance": [{"method": "OBSERVED", "source_adapter": "WEB_ACCESSIBILITY"}]},
      {"id": "search-panel", "name": "Search Panel", "semantic_role": "CUSTOMER_SEARCH", "origin": "ANALYSIS", "truth": "OBSERVED", "evidence_ids": ["EV-customer-list"], "confidence": 1, "verification_status": "VERIFIED", "provenance": [{"method": "OBSERVED", "source_adapter": "WEB_ACCESSIBILITY"}]},
      {"id": "search-button", "name": "Search Button", "semantic_role": "SEARCH_TRIGGER", "origin": "ANALYSIS", "truth": "OBSERVED", "evidence_ids": ["EV-search-button"], "confidence": 1, "verification_status": "VERIFIED", "provenance": [{"method": "OBSERVED", "source_adapter": "WEB_ACCESSIBILITY"}]},
      {"id": "customer-table", "name": "Customer Table", "semantic_role": "CUSTOMER_RESULTS", "origin": "ANALYSIS", "truth": "OBSERVED", "evidence_ids": ["EV-customer-list"], "confidence": 1, "verification_status": "VERIFIED", "provenance": [{"method": "OBSERVED", "source_adapter": "WEB_ACCESSIBILITY"}]},
      {"id": "customer-form", "name": "Customer Form", "semantic_role": "CUSTOMER_EDITOR", "origin": "ANALYSIS", "truth": "OBSERVED", "evidence_ids": ["EV-customer-detail"], "confidence": 0.97, "verification_status": "VERIFIED", "provenance": [{"method": "OBSERVED", "source_adapter": "WEB_ACCESSIBILITY"}]},
      {"id": "consultation-form", "name": "Consultation Form", "semantic_role": "CONSULTATION_EDITOR", "origin": "ANALYSIS", "truth": "OBSERVED", "evidence_ids": ["EV-consultation"], "confidence": 0.99, "verification_status": "VERIFIED", "provenance": [{"method": "OBSERVED", "source_adapter": "WEB_ACCESSIBILITY"}]}
    ],
    "actions": [
      {"id": "search-customer", "name": "SearchCustomer", "action_type": "QUERY", "origin": "ANALYSIS", "truth": "OBSERVED", "evidence_ids": ["EV-search-request"], "confidence": 1, "verification_status": "VERIFIED", "provenance": [{"method": "OBSERVED", "source_adapter": "WEB_NETWORK"}]},
      {"id": "open-customer", "name": "OpenCustomer", "action_type": "NAVIGATE", "origin": "ANALYSIS", "truth": "OBSERVED", "evidence_ids": ["EV-customer-detail"], "confidence": 0.99, "verification_status": "VERIFIED", "provenance": [{"method": "OBSERVED", "source_adapter": "WEB_ACCESSIBILITY"}]},
      {"id": "save-consultation", "name": "SaveConsultation", "action_type": "COMMAND", "origin": "ANALYSIS", "truth": "OBSERVED", "evidence_ids": ["EV-save-request"], "confidence": 1, "verification_status": "VERIFIED", "provenance": [{"method": "OBSERVED", "source_adapter": "WEB_NETWORK"}]}
    ],
    "behaviors": [
      {"id": "customer-search", "name": "CustomerSearch", "trigger_ref": "COMPONENT:search-button", "action_ref": "ACTION:search-customer", "result_refs": ["COMPONENT:customer-table", "DATA_ENTITY:customer"], "origin": "ANALYSIS", "truth": "OBSERVED", "evidence_ids": ["EV-search-button", "EV-search-request"], "confidence": 1, "verification_status": "VERIFIED", "provenance": [{"method": "OBSERVED", "source_adapter": "WEB_NETWORK"}]},
      {"id": "customer-open", "name": "CustomerOpen", "trigger_ref": "COMPONENT:customer-table", "action_ref": "ACTION:open-customer", "result_refs": ["SCREEN:customer-detail"], "origin": "ANALYSIS", "truth": "OBSERVED", "evidence_ids": ["EV-customer-detail"], "confidence": 0.99, "verification_status": "VERIFIED", "provenance": [{"method": "OBSERVED", "source_adapter": "WEB_ACCESSIBILITY"}]},
      {"id": "consultation-save", "name": "ConsultationSave", "trigger_ref": "COMPONENT:consultation-form", "action_ref": "ACTION:save-consultation", "result_refs": ["DATA_ENTITY:consultation-record"], "origin": "ANALYSIS", "truth": "OBSERVED", "evidence_ids": ["EV-save-request"], "confidence": 1, "verification_status": "VERIFIED", "provenance": [{"method": "OBSERVED", "source_adapter": "WEB_NETWORK"}]}
    ],
    "flows": [
      {"id": "customer-flow", "name": "CustomerFlow", "behavior_refs": ["BEHAVIOR:customer-search", "BEHAVIOR:customer-open", "BEHAVIOR:consultation-save"], "origin": "USER", "truth": "USER_VERIFIED", "evidence_ids": ["EV-user-flow"], "confidence": 1, "verification_status": "VERIFIED", "provenance": [{"method": "ENTERED", "source_adapter": "USER", "source_ref": "DEC-verify-customer-flow"}]}
    ],
    "data_entities": [
      {"id": "customer", "name": "Customer", "semantic_type": "BUSINESS_ENTITY", "origin": "ANALYSIS", "truth": "OBSERVED", "evidence_ids": ["EV-search-request"], "confidence": 0.96, "verification_status": "VERIFIED", "provenance": [{"method": "OBSERVED", "source_adapter": "WEB_NETWORK"}]},
      {"id": "consultation-record", "name": "Consultation Record", "semantic_type": "BUSINESS_ENTITY", "origin": "ANALYSIS", "truth": "OBSERVED", "evidence_ids": ["EV-save-request"], "confidence": 0.97, "verification_status": "VERIFIED", "provenance": [{"method": "OBSERVED", "source_adapter": "WEB_NETWORK"}]}
    ],
    "logic_rules": [
      {"id": "customer-query-rule", "name": "Customer Query Requires Criteria", "condition": "At least one search criterion is present", "outcome": "Customer query is submitted", "origin": "ANALYSIS", "truth": "DERIVED", "evidence_ids": ["EV-search-button", "EV-search-request"], "confidence": 0.85, "verification_status": "UNVERIFIED", "provenance": [{"method": "DERIVED", "source_adapter": "RULE_ENGINE", "source_ref": "rule:query-correlation"}]}
    ],
    "protected_assets": [
      {"id": "brand-logo", "name": "Original Brand Logo", "asset_type": "LOGO", "semantic_role": "PRIMARY_BRAND_MARK", "reuse_status": "PROTECTED", "replacement_strategy": "REPLACE", "origin": "ANALYSIS", "truth": "OBSERVED", "evidence_ids": ["EV-logo"], "confidence": 1, "verification_status": "VERIFIED", "provenance": [{"method": "OBSERVED", "source_adapter": "WEB_ACCESSIBILITY"}]}
    ],
    "oss_references": [